pub_date,headline,abstract,snippet,lead_paragraph,byline,section_name,web_url,source,multimedia_url
2024-02-29T11:47:55+0000,Biden’s Energy Balancing Act,The last few years have been great for energy production. You won’t hear the president bragging about it.,The last few years have been great for energy production. You won’t hear the president bragging about it.,"A junior White House economist made a chart last year — the sort of chart that previous presidents might have put in a campaign ad. It shows that U.S. energy production, from wind and solar to oil and gas, has boomed under President Biden. The nation is closer than ever to a goal that presidents have pursued for decades: true energy independence. ",By Jim Tankersley,Briefing,https://www.nytimes.com/2024/02/29/briefing/biden-oil-gas-production.html,The New York Times,https://www.nytimes.com/images/2024/02/29/multimedia/29themorning-nl-lede-2-promo/29themorning-nl-lede-2-tlfb-articleLarge.jpg
2024-02-27T21:54:15+0000,Why Are Influencers Pretending They Were Invited to an Oil Rig?,Several popular accounts on social media are pranking their loved ones by saying they’ve been invited to create offshore spon-con for Exxon Mobil.,Several popular accounts on social media are pranking their loved ones by saying they’ve been invited to create offshore spon-con for Exxon Mobil.,"For certain social media influencers, brand-sponsored trips are just part of the job. If they’re lucky, they may find themselves admiring the Instagrammably blue waters of the Greek islands, or perhaps the pink sunsets of Bali. But what about endless ocean views from the metal decks of an offshore oil rig?",By Frank Rojas,Style,https://www.nytimes.com/2024/02/27/style/exxon-mobil-tiktok.html,The New York Times,https://www.nytimes.com/images/2024/02/27/multimedia/27OIL-RIGGING-jtmb/27OIL-RIGGING-jtmb-articleLarge.jpg
2024-02-27T16:35:35+0000,Exxon Raises Questions About Chevron’s $53 Billion Deal for Hess,Exxon may try to upend its rival’s megadeal. The prize is a 30 percent stake in the oil-rich fields off the coast of Guyana.,Exxon may try to upend its rival’s megadeal. The prize is a 30 percent stake in the oil-rich fields off the coast of Guyana.,"America’s two largest energy companies, Exxon Mobil and Chevron, are jousting over a prized new source of oil in the waters off Guyana, in Latin America.",By Stanley Reed,Business Day,https://www.nytimes.com/2024/02/27/business/exxon-chevron-hess-guyana.html,The New York Times,https://www.nytimes.com/images/2024/02/27/multimedia/27exxon-chevon-fwvq/27exxon-chevon-fwvq-articleLarge.jpg
2024-02-27T10:00:22+0000,What Are Your Favorite Local Businesses?,"Bookstores, pizza joints, Chinese restaurants, vintage shops, toy stores or anything else. What local spots do you want to celebrate?","Bookstores, pizza joints, Chinese restaurants, vintage shops, toy stores or anything else. What local spots do you want to celebrate?","Local, independent businesses are part of what makes a city or town unique, especially with the proliferation of chain stores and restaurants across the country and around the world. ",By Shannon Doyne,The Learning Network,https://www.nytimes.com/2024/02/27/learning/what-are-your-favorite-local-businesses.html,The New York Times,https://www.nytimes.com/images/2024/01/31/multimedia/31Gas-Station-Food2-gkbc/29Gas-Station-Food2-gkbc-articleLarge.jpg
2024-02-23T19:41:05+0000,Biden to End an Unpopular Fuel Ban in Eight Farm States,"The administration will scrap summertime restrictions on gas blended with ethanol, which is made from corn.","The administration will scrap summertime restrictions on gas blended with ethanol, which is made from corn.","The Biden administration will permanently lift a ban on summertime sales of higher-ethanol gasoline blends in eight states starting in 2025, in response to a request from Midwestern governors who want year-round sales of the corn-based fuel.",By Coral Davenport,Climate,https://www.nytimes.com/2024/02/23/climate/summertime-ban-ethanol-lifted.html,The New York Times,https://www.nytimes.com/images/2024/02/23/multimedia/23cli-ethanol-bcpw/23cli-ethanol-bcpw-articleLarge.jpg
2024-02-22T21:29:24+0000,Why Oil Stocks Aren’t That Hot,We explore some of the patterns investors track to help understand what they show.,We explore some of the patterns investors track to help understand what they show.,Oil companies have recorded hundreds of billions of dollars in profits. Investment firms have backtracked their climate commitments. High interest rates are hurting clean energy companies.,By Manuela Andreoni,Climate,https://www.nytimes.com/2024/02/22/climate/oil-companies-trends-stocks.html,The New York Times,https://www.nytimes.com/images/2024/02/22/climate/22cli-newsletter-01/22cli-newsletter-01-articleLarge.jpg
2024-02-22T18:40:31+0000,U.S. Campaign to Isolate Russia Shows Limits After 2 Years of War,"Many nations insist on not taking sides in the war in Ukraine, while China, India and Brazil are filling Russia’s coffers.","Many nations insist on not taking sides in the war in Ukraine, while China, India and Brazil are filling Russia’s coffers.",The Biden administration and European allies call President Vladimir V. Putin of Russia a tyrant and a war criminal. But he enjoys a standing invitation to the halls of power in Brazil.,By Edward Wong and Michael Crowley,U.S.,https://www.nytimes.com/2024/02/22/us/politics/russia-war-anniversary-sanctions.html,The New York Times,https://www.nytimes.com/images/2024/02/22/multimedia/2dc-russia-diplo-bpcz/2dc-russia-diplo-bpcz-articleLarge.jpg
2024-02-21T20:00:02+0000,Ban Fossil Fuels? Readers Had Strong Thoughts.,Some lauded the idea. Others said it would play into OPEC’s hands.,Some lauded the idea. Others said it would play into OPEC’s hands.,"I got a lot of responses to my Friday newsletter on restricting the supply of fossil fuels, one of which said “oof no” in the subject line. It was from an economist named Benjamin Ho, who wrote that he usually likes my newsletter, “But, oh boy, was today’s off track.”",By Peter Coy,Opinion,https://www.nytimes.com/2024/02/21/opinion/fossil-fuel-ban-climate.html,The New York Times,https://www.nytimes.com/images/2024/02/21/opinion/21coy-newsletter-art/21coy-newsletter-art-articleLarge.jpg
2024-02-19T20:00:07+0000,Long Island and the Limits of Sabotage,Republicans’ deliberate chaos might not pay off.,Republicans’ deliberate chaos might not pay off.,"Last week, Tom Suozzi won handily in the special election in New York’s Third Congressional District to fill the seat vacated by the serial fraudster George Santos — reclaiming the seat that Suozzi previously held. This was the latest in a series of Democratic victories in special elections, victories that seem on their face to run counter to polls showing Donald Trump leading Joe Biden in the presidential race.",By Paul Krugman,Opinion,https://www.nytimes.com/2024/02/19/opinion/suozzi-democrats-republicans.html,The New York Times,https://www.nytimes.com/images/2024/02/20/multimedia/19krugman1-jzhb/19krugman1-jzhb-articleLarge.jpg
2024-02-17T05:43:40+0000,Virginia House Explosion Kills Firefighter and Injures 13 Others,"Fire crews were responding to reports of a gas leak in Sterling, a suburb of Washington, when the home exploded with firefighters inside.","Fire crews were responding to reports of a gas leak in Sterling, a suburb of Washington, when the home exploded with firefighters inside.","A firefighter was killed after a house in Virginia exploded Friday night, injuring 13 other people and scattering pieces of the home across the neighborhood, officials said.",By John Yoon and Aimee Ortiz,U.S.,https://www.nytimes.com/2024/02/17/us/firefighter-killed-virginia-explosion.html,The New York Times,https://www.nytimes.com/images/2024/02/16/multimedia/16xp-house-explode-02/16xp-house-explode-02-articleLarge.jpg
2024-02-16T20:00:16+0000,Why Don’t We Just Ban Fossil Fuels?,"The idea doesn’t make sense now, but it’s still worth thinking about.","The idea doesn’t make sense now, but it’s still worth thinking about.","Imagine there were no law against arson and we were trying to figure out a way to stop it. One way would be to require people to pay for the right to burn down buildings. Another would be to issue a strictly limited number of tradable arson-permission certificates, which would-be arsonists could trade among themselves. We could spend money making buildings more fireproof. Or we could invent new flammable objects that would satisfy arsonists’ desire to burn things down but whose combustion would cause less societal harm.",By Peter Coy,Opinion,https://www.nytimes.com/2024/02/16/opinion/fossil-fuel-ban-climate.html,The New York Times,https://www.nytimes.com/images/2024/02/19/opinion/16coy-newsletter-art/16coy-newsletter-art-articleLarge-v4.jpg
2024-02-16T19:39:21+0000,"Ross Gelbspan, Who Exposed Roots of Climate Change Deniers, Dies at 84","A longtime investigative journalist, he wrote books and articles that documented a campaign of disinformation intended to sow doubt about global warming.","A longtime investigative journalist, he wrote books and articles that documented a campaign of disinformation intended to sow doubt about global warming.","Ross Gelbspan, an investigative journalist whose reporting on climate change exposed a campaign of disinformation by oil and gas lobbyists to sow doubt about global warming — a denialism that was embraced by Republican officials and, in some cases, by a credulous news media — died on Jan. 27 at his home in Boston. He was 84.",By Trip Gabriel,Business Day,https://www.nytimes.com/2024/02/16/business/media/ross-gelbspan-dead.html,The New York Times,https://www.nytimes.com/images/2024/02/19/multimedia/15Gelspan--01-tjcf-print1/15Gelspan--01-tjcf-articleLarge.jpg
2024-02-16T10:05:20+0000,The $2.8 Billion Hole in U.S. Sanctions on Iran,"A Times investigation reveals how lax government oversight allowed shadowy oil tankers, covered by American insurance, to fund Iran’s regime.","A Times investigation reveals how lax government oversight allowed shadowy oil tankers, covered by American insurance, to fund Iran’s regime.","A Times investigation reveals how lax government oversight allowed shadowy oil tankers, covered by American insurance, to fund Iran’s regime.","By Christiaan Triebert, Blacki Migliozzi, Neil Bedi and Alexander Cardia",World,https://www.nytimes.com/interactive/2024/02/16/world/middleeast/iran-oil-tankers-sanctions.html,The New York Times,https://www.nytimes.com/images/2024/02/15/video/15vi-tankers-promo/15vi-tankers-promo-articleLarge.jpg
2024-02-13T06:00:00+0000,Why This Group of Undecided Independent Voters Is Leaning Toward Trump,The participants discuss the issues that may sway them to vote for Biden or Trump.,The participants discuss the issues that may sway them to vote for Biden or Trump.,The participants discuss the issues that may sway them to vote for Biden or Trump.,"By Patrick Healy, Margie Omero and Adrian J. Rivera",Opinion,https://www.nytimes.com/interactive/2024/02/13/opinion/independents-biden-focus-group.html,The New York Times,https://www.nytimes.com/images/2024/02/20/opinion/2024-02-09-focusgroup-independents-promo/2024-02-09-focusgroup-independents-promo-articleLarge.png
2024-02-12T11:13:57+0000,Two Big Texas Oil Producers Announce $26 Billion Merger,Diamondback Energy and Endeavor Energy Resources are both major players in the booming Permian Basin.,Diamondback Energy and Endeavor Energy Resources are both major players in the booming Permian Basin.,"Two large Texas oil producers are joining forces in a deal valued at $26 billion, the latest in a wave of consolidation in the U.S. energy industry.",By Karen Weise,Business Day,https://www.nytimes.com/2024/02/12/business/diamondback-energy-endeavor-energy-permian-basin.html,The New York Times,https://www.nytimes.com/images/2024/02/11/multimedia/00energy-deal-1-vzkf/00energy-deal-1-vzkf-articleLarge.jpg
2024-02-09T16:30:11+0000,How Two Irish Businessmen Almost Took Nigeria for $11 Billion,A mundane contractual provision met with rampant corruption — revealing a serious vulnerability in one of the backbones of international commerce.,A mundane contractual provision met with rampant corruption — revealing a serious vulnerability in one of the backbones of international commerce.,"Like a lot of explosive financial scandals, the story of Michael Quinn and Brendan Cahill could fairly be described as a simple proposition that spun completely out of control.",By Jesse Barron,Magazine,https://www.nytimes.com/2024/02/09/magazine/nigeria-corruption-michael-quinn-brendan-cahill.html,The New York Times,https://www.nytimes.com/images/2024/02/11/magazine/11mag-nigerian1/11mag-nigerian1-articleLarge.jpg
2024-02-07T10:02:53+0000,"How Ford’s F-150 Lightning, Once in Hot Demand, Lost Its Luster","Some buyers said the electric Lightning did not meet expectations, and Ford has slashed its production plans for the pickup because sales are lagging.","Some buyers said the electric Lightning did not meet expectations, and Ford has slashed its production plans for the pickup because sales are lagging.",In July Michael Puglia drove home with what seemed like the coolest vehicle he’d ever own — a Ford F-150 Lightning electric pickup truck.,By Neal E. Boudette,Business Day,https://www.nytimes.com/2024/02/07/business/fords-f150-lightning-electric-pickup-trucks.html,The New York Times,https://www.nytimes.com/images/2024/02/05/multimedia/00electric-pickup-01-fwtq/00electric-pickup-01-fwtq-articleLarge.jpg
2024-02-06T14:27:57+0000,"BP to Increase Oil Output, New Chief Says","Murray Auchincloss signaled that he would take a more profit-oriented approach than his predecessor, who started a big push into renewables.","Murray Auchincloss signaled that he would take a more profit-oriented approach than his predecessor, who started a big push into renewables.","BP’s new chief executive, Murray Auchincloss, promised a flexible approach to the shift away from fossil fuels as the oil giant reported a $3 billion profit in its latest quarter on Tuesday.",By Stanley Reed,Business Day,https://www.nytimes.com/2024/02/06/business/bp-oil-gas-profits.html,The New York Times,https://www.nytimes.com/images/2024/02/06/multimedia/06bp-jfvk/06bp-jfvk-articleLarge.jpg
2024-02-05T19:22:47+0000,Two Climate Advisers Quit U.S. Export-Import Bank Over Fossil Fuel Plans,"The bank is set to vote Thursday on financing an oil project in Bahrain, the latest in a string of overseas fossil fuel projects.","The bank is set to vote Thursday on financing an oil project in Bahrain, the latest in a string of overseas fossil fuel projects.","A federal bank that finances projects overseas is set to vote on Thursday on whether to use taxpayer dollars to help drill oil and gas wells in Bahrain, a contentious decision that prompted two of the bank’s climate advisers to resign, according to people with knowledge of their decisions.",By Lisa Friedman and Hiroko Tabuchi,Climate,https://www.nytimes.com/2024/02/05/climate/export-import-bank-climate.html,The New York Times,https://www.nytimes.com/images/2024/02/05/multimedia/05cli-exim-01-ctqw/05cli-exim-01-ctqw-articleLarge.jpg
2024-02-05T10:01:45+0000,Why Are Americans Wary While the Economy Is Healthy? Look at Nevada.,"Economic shocks over two decades, combined with reliance on volatile casinos, have undermined confidence despite an economy that’s bustling.","Economic shocks over two decades, combined with reliance on volatile casinos, have undermined confidence despite an economy that’s bustling.","Toni Irizarry recognizes that the economy has improved. Compared with the first wave of the pandemic, when Las Vegas went dark, and joblessness soared to levels not seen since the Great Depression, these are days of relative normalcy.",By Peter S. Goodman and Bridget Bennett,Business Day,https://www.nytimes.com/2024/02/05/business/economy/nevada-economy-primary-election.html,The New York Times,N/A
2024-02-03T10:03:52+0000,Bank of America Pledged to Stop Financing Coal. Now It’s Backtracking.,The changes come as Republican lawmakers step up efforts to punish businesses that consider climate change and the environment in their operations.,The changes come as Republican lawmakers step up efforts to punish businesses that consider climate change and the environment in their operations.,"Two years ago, Bank of America won kudos from climate activists for saying it would no longer finance new coal mines, coal-burning power plants or Arctic drilling projects because of the toll they take on the environment.",By Hiroko Tabuchi,Climate,https://www.nytimes.com/2024/02/03/climate/bank-of-america-esg.html,The New York Times,https://www.nytimes.com/images/2024/02/03/climate/03cli-coal-loans/03cli-coal-loans-articleLarge.jpg
2024-02-02T16:35:30+0000,U.N. Climate Chief Warns Countries Against ‘Hiding Behind Loopholes’,Simon Stiell used a speech in Azerbaijan to set expectations for global climate negotiations there this year.,Simon Stiell used a speech in Azerbaijan to set expectations for global climate negotiations there this year.,"In a speech on Friday, the United Nations climate chief painted an optimistic picture of the fight against global warming while taking a jab at countries that avoid meeting their obligations by “hiding behind loopholes” in global agreements.",By Max Bearak,Climate,https://www.nytimes.com/2024/02/02/climate/azerbaijan-climate-summit-cop29.html,The New York Times,https://www.nytimes.com/images/2024/02/02/multimedia/02cli-UNSPEECH-tpjb/02cli-UNSPEECH-tpjb-articleLarge.jpg
2024-02-02T15:48:47+0000,"The Economy Looks Sunny, a Potential Gain for Biden",Recession fears have eased. Growth and job gains are beating expectations. Inflation is cooling. Consumers are happier. The president is waiting to benefit.,Recession fears have eased. Growth and job gains are beating expectations. Inflation is cooling. Consumers are happier. The president is waiting to benefit.,"A run of strong economic data appears to have finally punctured consumers’ sour mood about the U.S. economy, blasting away recession fears and potentially aiding President Biden in his re-election campaign.",By Jim Tankersley,U.S.,https://www.nytimes.com/2024/02/02/us/politics/biden-economy.html,The New York Times,https://www.nytimes.com/images/2024/02/02/multimedia/02dc-biden-econ-zgmj/02dc-biden-econ-zgmj-articleLarge.jpg
2024-02-02T13:59:30+0000,Oil Giants Pump Their Way to Bumper Profits,"Exxon, Chevron and Shell reported robust earnings and large payouts to investors as they continued to expand their fossil-fuel production.","Exxon, Chevron and Shell reported robust earnings and large payouts to investors as they continued to expand their fossil-fuel production.","Exxon Mobil and Chevron, the largest U.S. energy companies, on Friday reported sizable profits for the final quarter of last year, showing that the oil and gas industry remained robust at a time of doubts because of climate change concerns.",By Stanley Reed,Business Day,https://www.nytimes.com/2024/02/02/business/oil-gas-companies-profits.html,The New York Times,https://www.nytimes.com/images/2024/02/01/multimedia/00oil-earnings-gvwk/00oil-earnings-gvwk-articleLarge.jpg
2024-02-01T10:01:33+0000,They Love Costco So Much They Wrote a Book About It,"David and Susan Schwartz, who live in a tiny Manhattan apartment, have visited more than 200 Costco stores.","David and Susan Schwartz, who live in a tiny Manhattan apartment, have visited more than 200 Costco stores.",Good morning. It’s Thursday. Today we’ll meet a Manhattan couple who went to 47 states and 14 countries for a book about Costco. We’ll also find out about a four-decade fight to exonerate two men convicted of killing a French tourist in a mugging in 1987.,By James Barron,New York,https://www.nytimes.com/2024/02/01/nyregion/costco-book.html,The New York Times,https://www.nytimes.com/images/2024/02/01/multimedia/01nytoday-qcwz/01nytoday-qcwz-articleLarge.jpg
